,OBJRANK,WEIGHT(KG),FARM,FARMER/REPRESENTATIVE,REGION,SCORE,VARIETY,PROCESS,NUMRANK,HIGH_BID,TOTAL_VALUE,BUYERS,COUNTRY,YEAR
1922,19,1680.0,La Begona,Oscar Ernesto Aguilar Jovel,"La Palma, Chalatenango",85.8,,,19,6.6,24420.0,Seven Seeds,El Salvador,2013
1923,20,1740.0,Santa Rosa,J. Raul Rivera S.A. de C.V.,"Chalatenango, Alotepec-Metapán",85.77,,,20,5.6,21358.4,honuKATOCOFFEE Inc.,El Salvador,2013
1924,21,1320.0,Luz Estela,Custodio S.A. de S.V.,"Santa Ana, Santa Ana",85.67,,,21,6.0,17442.0,"[BUSAN GROUP] – Coffee Loves Him Roasting Company, MOMOS COFFEE, Black Up Coffee Factory, Coffee Eyagi, In Earth Coffee, COFFEE GEEKS, People N Talk Coffee & COFFEE LIBRE",El Salvador,2013
1925,22,570.0,Las Brumas,Juan Jose Ernesto Menendez Arguello,"Sonsonate, Apaneca-Ilamatepec",85.53,,,22,7.1,8867.9,"Wataru & Co., Ltd.",El Salvador,2013
1926,23,540.0,La Lagunita,Gloria Mercedes Rodriguez Fontan,"Apaneca, Ahuachapan",85.47,,,23,6.6,7939.8,"Wataru & Co., Ltd.",El Salvador,2013
1927,24,660.0,Himalaya – Tablon Divisadero,Mauricio Arturo Salaverria Caceres,"Apaneca, Ahuachapan",85.43,,,24,6.5,9295.0,CHOI Coffee Roasters Company & Seoul Barista School,El Salvador,2013
1928,25,1020.0,Bello Horizonte,Jose Thomas Calderon Sol,"Santa Tecla, La Libertad",85.3,,,25,6.1,13511.5,"Falcon Speciality Green Coffee Importers, Small Batch Coffee Company",El Salvador,2013
1929,1,1170.0,Las Brumas 1,Juan Jose Ernesto Menendez Arguello,"Izalco, Sonsonate",90.82,,,1,26.5,68353.57,"Time’s Club for C-COOP, Honey Coffee (Japan) and Coffee Libre (South Korea)",El Salvador,2012
1930,2,1440.0,La Laguna,Gonzalo Antonio Ticas Reyes,"Citalá, Chalatenango",90.12,,,2,18.6,59048.86,"Maruyama Coffee, Yamada Coffee, Orsir Coffee (Taiwan)",El Salvador,2012
1931,3,1410.0,El Porvenir,Adilia Encarnacion Aguilar Murillo De Pullinger,"Chinameca, San Miguel",89.06,,,3,14.8,46005.5,Mayorga Coffee,El Salvador,2012
1932,4,1170.0,El Optimismo,Lucia Martinez De Zepeda,"Alegría, Usulutan",88.97,,,4,15.1,38948.79,"TERAROSA (Hanksan Co.Ltd), Rawbean Coffee Academy and Beanybeans & Beany Roasters",El Salvador,2012
1933,5,1290.0,Los Pirineos,Los Pirineos S.A. De C.V.,"Berlín, Usulutan",88.79,,,5,10.1,28723.79,"Saza Coffee, Bontain Coffee Co.,Ltd., Cafe LuLu (Taiwan)",El Salvador,2012
1934,6,1560.0,La Montañita,Antonio Rene Aguilar Lemus,"La Palma, Chalatenango",88.44,,,6,8.7,29920.87,Mocoway Specialty Coffee (China),El Salvador,2012
1935,7,1170.0,Llano Grande,"Sicafe, S.A. De C.V.","Apeneca, Ahuachapan",88.44,,,7,10.1,26051.84,"Trabocca, Åre Kafferosteri",El Salvador,2012
1936,8,1380.0,Miravalle (2012),Jaime Ernesto Riera Menendez,"Santa Ana, Santa Ana",88.32,,,8,10.0,30423.5,"Mercanta The Coffee Hunters for Fonte Coffee Roasters (USA), Dutch Barista Coffee(NL), Caffè Cataldi (FR), Has Bean Coffee (UK), Melbourne Coffee Merchants (AUS), James Gourmet Coffee (UK), Origin Coffee Roasting (SA) and Ristretto Coffee Roasters (AUS)",El Salvador,2012
1937,9,1260.0,Fatima,Carmen Duch Martinez,"Santa Ana, Santa Ana, Apaneca-Ilamatepec",87.65,,,9,7.8,21666.76,"Specialty Coffee Inc,., Beon-Ku Jeon Roaster, JJ Coffee Company, Café Golden Cup-Olympic Park, Martys Coffee in Shin-Lim, AnYang Specialty Coffee Academy, King’s coffee, Hanjuha’s coffee (Korea), Haru int’l(Taiwan)",El Salvador,2012
1938,10,1320.0,Peña Redonda,Carlos Mauricio Lemus Landaverde,"La Palma, Chalatenango",86.62,,,10,7.01,20399.52,"Wataru & Co., Ltd.",El Salvador,2012
1939,11,1410.0,Nazareth,Andreas F Giron Dalmas,"Ahuachapán, Ahuachapan",86.56,,,11,6.2,19272.51,"Wataru & Co., Ltd.",El Salvador,2012
1940,12,1260.0,Las Delicias,"Casal, S.A. De C.V.","Ahuachapán, Ahuachapan",86.29,,,12,9.2,25555.67,Coffee Bean International for Target,El Salvador,2012
1941,13,1410.0,Helvetia,Carmen Elena Calderon Sol De Escalon,"Concepción de Ataco, Ahuachapan",85.91,,,13,6.0,18651.0,"EL CAFE coffee roasters, Caffe Themselves, Told a story, Coffeesociety, The 3rd place, Beansfree",El Salvador,2012
1942,14,1710.0,Las Mercedes 2,Juan Carlos Rodriguez Garcia,"Chalchuapa, Santa Ana",85.91,,,14,5.6,21111.33,Kyokuto Fadie Corporation,El Salvador,2012
1943,15,1320.0,La Nueva,Rafael Duch Martinez,"Santa Ana, Santa Ana",85.85,,,15,7.2,20952.43,TERAROSA(HAKSAN Co.Ltd),El Salvador,2012
1944,16,1410.0,El Rodeo,Julio Cesar Salaverria Caceres,"Juayúa, Sonsonate",85.79,,,16,6.6,20516.1,Kaffebrenneriet as,El Salvador,2012
1945,17,1590.0,Santa Isabel,"La Gloria ,S.A. De C.V.","Nejapa, San Salvador",85.79,,,17,5.4,18928.67,"Melbourne Coffee Merchants on behalf of Dukes Coffee Roasters, Dimattina Coffee, Ministry Grounds, Elixir Coffee Specialists, Cleanskin Coffee Co., Ristretto Coffee Roasters and Market Lane Coffee (AUS) and Mercanta The Coffee Hunters for Fortnum & Mason",El Salvador,2012
1946,18,1650.0,El Zarzal,Benjamin Anthony Argueta,"Tepetitán, San Vicente",85.68,,,18,5.7,20734.32,"Nippon Coffee Trading Co., Ltd.",El Salvador,2012
1947,19,1680.0,San Jose 2,Oto Salvador Carcamo Rodriguez,"Atiquizaya, Ahuachapan",85.59,,,19,5.61,20777.93,honuKATOCOFFEE Inc.,El Salvador,2012
1948,20,1230.0,La Siberia,Rafael Enrique Silva Hoff,"Chalchuapa, Santa Ana",85.53,,,20,5.21,14127.75,"Mercanta The Coffee Hunters for Has Bean Coffee (UK), Melbourne Coffee Merchants (AUS), Dutch Barista Coffee(NL), Twoday Coffee Roasters (UK), Knopes Artisan Torrefacteur (Bel), Bolling Coffee (UK)",El Salvador,2012
1949,21,1200.0,San Blas 1,"Monte San Blas, S.A. De C.V.","Santa Ana, Santa Ana",85.5,,,21,7.06,18677.3,Kaffebrenneriet as,El Salvador,2012
1950,22,1380.0,Montes Everest,Gustavo Ernesto Urrutia Polanco,"Ahuachapán, Ahuachapan",85.5,,,22,6.2,18862.51,"Tashiro Coffee Co.,Ltd",El Salvador,2012
1951,23,1350.0,La Esperanza,"Cafescal, S.A. De C.V.","Tacuba, Ahuachapan",85.5,,,23,5.8,17261.96,"Wataru & Co., Ltd.",El Salvador,2012
1952,24,1440.0,El Conrradul,Jose Armando Portillo Peraza,"La Palma, Ahuachapan",85.32,,,24,5.7,18095.33,Coffee Meikan,El Salvador,2012
1953,25,1020.0,Tizapa,Graciela Haydee Magaña De Fortin-Magaña,"Apeneca, Ahuachapan",85.32,,,25,8.1,18214.39,Black Cat Kaffe og Tehus AS,El Salvador,2012
1954,26,1320.0,Santa Alicia,Quiñonez Caminos Y Compañia,"Santa Tecla, La Libertad",85.29,,,26,5.6,16296.45,Coffee Bean International for Target,El Salvador,2012
1955,27,1350.0,La Cumbre,Los Pirineos S.A. De C.V.,"Berlín, Usulutan",85.29,,,27,6.0,17857.32,Silo Coffee Store,El Salvador,2012
1956,28,1740.0,Las Mercedes,Giron Salazar Hijos Y Cia Francisco,"Chalchuapa, Santa Ana",85.09,,,28,5.3,20330.85,"BUSAN group – Momos coffee, Coffee Gongjang, Coffee Loves Him, In Earth Coffee.",El Salvador,2012
1957,1,1260.0,Roxanita,Ignacio Gutierrez Solis,"Chalatenango, Alotepec-Metapán",93.19,,,1,19.2,52704.0,"Times Club for C-COOP, Kyokuto Fadie Corporation, Bontain Coffee (Japan) and Coffee Libre (South Korea)",El Salvador,2011
1958,2,1560.0,El Porvenir,Adilia Encarnación Aguilar de Pullinger,"San Miguel, Tecapa-Chinameca",92.56,,,2,15.0,51585.0,"KAFFA, Oslo",El Salvador,2011
1959,3,1260.0,La Reforma,"Fincal, S.A. De C.V.","Santa Ana, Apaneca-Ilamatepec",91.72,,,3,10.4,28891.2,"Yokoi Coffee, Sugi Coffee Roasting and Maruyama Coffee(Japan) and Orsir Coffee(Taiwan)",El Salvador,2011
1960,4,1230.0,Malacara Lote B,"Chantuc, S.A. De C.V.","Santa Ana, Apaneca-Ilamatepec",90.83,,,4,14.55,38979.45,"Terarosa, Beanybeans Coffee & Beany Roasters, Belief Coffee, Pohang Arabica, Rawbean Coffee Academy and Wonhyoro Coffee",El Salvador,2011
1961,5,1380.0,Santa Rosa,J. Raul Rivera S.A. de C.V.,"Chalatenango, Alotepec-Metapán",90.69,,,5,10.0,30420.0,"Tashiro Coffee Co.,Ltd",El Salvador,2011
1962,6,1980.0,Los Planes,Sergio Edmundo Ticas Reyes,"Chalatenango, Citala",90.06,,,6,10.06,43579.92,"Café Imports, Kean Coffee, Cultiva, Coffee Klatch, Dogwood Coffee, Willoughby’s, and PT’s Coffee",El Salvador,2011
1963,7,1410.0,Las Delicias,Compañia Agropecuaria Salvadoreña S.A. De C.V.,"Ahuachapan, Apaneca-Ilamatepec",89.22,,,7,9.16,28469.28,"Mercanta The Coffee Hunters for Twoday Coffee Roasters (UK), Caffè Cataldi (FR), Café Knopes (BE), Fonte Coffee Roaster (USA), Cartel Coffee Lab (USA), Montana Coffee Traders (USA) and Melbourne Coffee Merchants (AUS)",El Salvador,2011
1964,8,1500.0,Miravalle (2012),Jaime Ernesto Riera Menendez,"Santa Ana, Santa Ana",88.89,,,8,6.0,19842.0,InterAmerican Coffee GmbH (Germany) with Cafe Kaiser Konditorei GmbH (Gremany) and Rast Kaffee AG (Switzerland),El Salvador,2011
1965,9,1650.0,Santa Josefita,Lima Y Socios,"Ahuachapan, Apaneca-Ilamatepec",88.78,,,9,6.1,21990.5,"Wataru & Co., Ltd.",El Salvador,2011
1966,10,1380.0,Sagrado Corazon,Anna Elaine Del Carmen Rivas De Vega,"Santa Ana, Apaneca-Ilamatepec",88.64,,,10,6.1,18354.9,"Hiro Coffee Co.,Ltd.",El Salvador,2011
1967,11,1680.0,Nombre De Dios,Maria Elena Dominguez De Botto Isassi,"Santa Ana, Alotepec-Metapán",88.44,,,11,4.9,18149.6,Specialty Coffee Inc.(Korea),El Salvador,2011
1968,12,1920.0,El Optimismo,Lucia Conocida Por Socorro Martinez De Zepeda,"Usulutan, Tecapa-Chinameca",88.08,,,12,5.1,21588.3,"Toa Coffee Co., Ltd",El Salvador,2011
1969,13,1290.0,El Pinar,Ana Eugenia Matilde Dominguez De Bauza,"Santa Ana, Alotepec-Metapán",88.06,,,13,5.5,15642.0,"Invalsa Coffee® (USA) & Specialty Coffee Inc. (Korea), Moxxee Coffee (USA), Java Blend (Canada), Reality Roasters (USA), Linking Coffee (Taiwan), Bard Coffee (USA), Georgio’s Coffee (USA)",El Salvador,2011
1970,14,1560.0,Cerro Negro,Blanca Marina Peraza De Portillo,"Chalatenango, Alotepec-Metapán",88.03,,,14,5.2,17882.8,InterAmerican Coffee GmbH,El Salvador,2011
1971,15,1950.0,San Carlos,Marta Dolores Menendez De Riera,"Santa Ana, Apaneca-Ilamatepec",87.69,,,15,4.3,18485.7,"MI Coffee coporation for EL CAFE coffee roasters, Caffe Themselves, CoffeeRadio, Design Coffee Roasters, Momo’s coffee, Coffee Factory, and CHOI coffee/seoul barista school",El Salvador,2011
1972,16,1200.0,Monte Everesth,Gustavo Ernesto Urrutia Polanco,"Ahuachapan, Apaneca-Ilamatepec",87.47,,,16,5.1,13494.6,"Tashiro Coffee Co.,Ltd",El Salvador,2011
1973,17,1230.0,Los Pirineos,Los Pirineos S.A. De C.V.,"Berlín, Usulutan",87.36,,,17,8.1,21967.2,Saza Coffee (Japan),El Salvador,2011
1974,18,1230.0,La Nueva,Rafael Duch Martinez,"Santa Ana, Santa Ana",87.28,,,18,4.5,12204.0,Coffee Supreme Limited,El Salvador,2011
1975,19,1440.0,El Rosario,"Compañia Agropecuaria De Exportacion Centroamericana, S.A. De C.V.","Ahuachapan, Apaneca-Ilamatepec",87.22,,,19,4.5,14287.5,Midwest Coffee Trading Inc.,El Salvador,2011
1976,20,1470.0,Santa Elena,Ernesto Ramon Lima Rivera,"Santa Ana, Apaneca-Ilamatepec",87.17,,,20,4.5,14584.5,T.A.N. Coffee,El Salvador,2011
1977,21,2160.0,Nazareth,Mario Ernesto Acosta Oertel,"Ahuachapan, Apaneca-Ilamatepec",87.08,,,21,4.0,19048.0,honuKATOCOFFEE Inc.,El Salvador,2011
1978,22,1290.0,Santa Rosa,Los Pirineos S.A. De C.V.,"Usulutan, Tecapa-Chinameca",87.06,,,22,6.0,17064.0,Saza Coffee (Japan),El Salvador,2011
1979,23,1260.0,Las Brumas,Juan Jose Ernesto Menendez Arguello,"Sonsonate, Apaneca-Ilamatepec",86.81,,,23,9.2,25557.6,Seven Seeds and The Source,El Salvador,2011
1980,24,2040.0,Graciela,"Rioduero, S.A. De C.V.","Santa Ana, Apaneca-Ilamatepec",86.58,,,24,4.0,17856.0,honuKATOCOFFEE Inc.,El Salvador,2011
1981,25,2040.0,San Isidro,Bessie Batres Smith De Giron,"Ahuachapán, Apaneca-Ilamatepec",86.47,,,25,4.0,17988.0,honuKATOCOFFEE Inc.,El Salvador,2011
1982,26,1530.0,Santa Sofia,"Pacvil, S.A. De C.V.","Santa Ana, Santa Ana",86.33,,,26,4.3,14503.9,"Nippon Coffee Trading Co.,Ltd",El Salvador,2011
1983,27,1170.0,Miralvalle (El Zapote),Gustavo E. Urrutia Polanco Y Cia.,"Ahuachapan, Apaneca-Ilamatepec",86.22,,,27,4.1,10573.9,"Wataru & Co., Ltd.",El Salvador,2011
1984,28,1590.0,Las Palmas,Los Pirineos S.A. De C.V.,"Usulutan, Tecapa-Chinameca",86.14,,,28,6.1,21380.5,Kyokuto Fadie Corporation,El Salvador,2011
1985,29,1080.0,Nicolas Mountain,"Marco Antonio Batres, Teresa Eugenia Giamattei Y Cia.","Ahuachapan, Apaneca-Ilamatepec",86.11,,,29,5.3,12444.4,"Mercanta The Coffee Hunters for Caffè Cataldi (FR), Oriole Coffee Roasters (SG), Dutch Barista Coffee (NL), Fonte Coffee Roaster (USA), Has Bean Coffee (UK) and Melbourne Coffee Merchants (AUS)",El Salvador,2011
1986,30,1050.0,Montserrat,Maria De Los Angeles Arevalo Hernandez De Oporto,"Sonsonate, Apaneca-Ilamatepec",86.03,,,30,6.6,15061.2,Kaffebrenneriet as,El Salvador,2011
1987,31,1380.0,La Esperanza,"Inversiones Santonano, S.A. De C.V.","Santa Ana, Apaneca-Ilamatepec",85.86,,,31,4.3,12938.7,"Caffebene Co., Ltd.",El Salvador,2011
1988,32,1470.0,Nejapa I,Juan Carlos Gregg Meza,"Ahuachapan, Apaneca-Ilamatepec",85.81,,,32,4.2,13473.6,"Nippon Coffee Trading Co.,Ltd",El Salvador,2011
1989,33,1230.0,La Lagunita/La Gloria,Gloria Rodriguez/Maria Jose Rodriguez,"Ahuachapan, Apaneca-Ilamatepec",85.75,,,33,4.4,11787.6,Kaffebrenneriet as,El Salvador,2011
1990,34,1440.0,Andalucia – {O},Sociedad Lima Y Hermanos,"Ahuachapan, Apaneca-Ilamatepec",85.72,,,34,4.5,14287.5,"Café Imports, Dallis Bros. Coffee, The Roasterie, Olympia Coffee Roasting Co., Noble Coffee Roasting and Barnie’s Coffee & Tea Company",El Salvador,2011
1991,35,1530.0,El Islahuat,Victor Hugo Mata Tobar,"Ahuachapan, Apaneca-Ilamatepec",85.72,,,35,4.1,13829.3,M.I. Coffee Corporation,El Salvador,2011
1992,36,1380.0,Finca Tizapa Tablon Cajete,Graciela Haydee Magaña De Fortin Magaña,"Ahuachapan, Apaneca-Ilamatepec",85.58,,,36,4.0,12036.0,honuKATOCOFFEE Inc.,El Salvador,2011
1993,37,1590.0,Las Mercedes,Juan Carlos Rodriguez Garcia,"Santa Ana, Apaneca-Ilamatepec",85.31,,,37,4.1,14235.2,"Wataru & Co., Ltd.",El Salvador,2011
1994,38,1410.0,Tablon Divisadero,Mauricio Arturo Salaverria Caceres,"Ahuachapan, Apaneca-Ilamatepec",85.17,,,38,4.1,12742.8,Campos Coffee,El Salvador,2011
1995,39,1560.0,Santa Maria,"Himalaya, S.A. De C.V.","Ahuachapan, Apaneca-Ilamatepec",85.11,,,39,4.0,13624.0,honuKATOCOFFEE Inc.,El Salvador,2011
1996,40,1230.0,El Topacio,Maria Elena Avila Magaña De Muyshondt,"Juayúa, Sonsonate, Apaneca-Ilamatepec",85.06,,,40,5.1,13831.2,"Wataru & Co., Ltd.",El Salvador,2011
1997,41,1260.0,La Esmeralda,Oscar Roberto Murgas Linares,"Ahuachapan, Apaneca-Ilamatepec",84.92,,,41,4.0,10980.0,M.I. Coffee Corporation,El Salvador,2011
1998,42,1350.0,El Jocotillo,Anna Elaine Del Carmen Rivas De Vega,"Santa Ana, Apaneca-Ilamatepec",84.14,,,42,4.0,11900.0,"Orsir coffee Co., Ltd.",El Salvador,2011
1999,1,1080.0,Suiza,Julia Margarita Martinez Molina,"Santa Ana, Apaneca-Ilamatepec",91.05,,,1,28.0,66696.0,Coffee Bean International for Target,El Salvador,2010
2000,2,1050.0,El Ausol,Maria Elena Avila Magaña De Muyshondt,"Ahuachapán, Apaneca-Ilamatepec",90.48,,,2,17.55,40207.05,"Kyokuto Fadie Corporation, Time’s Club for C-COOP",El Salvador,2010
2001,3,1800.0,La Montañita,Antonio Rene Aguilar Lemus,"La Palma, Chalatenango",90.45,,,3,8.41,32925.15,"Tashiro Coffee Co.,Ltd, Time’s Club for C-COOP, Bontain Coffee, Orsir Coffee (Taiwan)",El Salvador,2010
2002,4,2280.0,San Isidro,Bessie Batres Smith De Giron,"Ahuachapán, Apaneca-Ilamatepec",89.25,,,4,7.2,36108.0,Green Mountain Coffee,El Salvador,2010
2003,5,1200.0,Los Andes,Juan José Ernesto Menéndez Argüello,"Santa Ana, Apaneca-Ilamatepec",89.16,,,5,9.45,24711.75,"TOA COFFEE Co.,Ltd.",El Salvador,2010
2004,6,1380.0,San Joaquin,F.A. Pacas Y Cia,"Santa Ana, Apaneca-Ilamatepec",88.86,,,6,10.25,31242.0,M.I. Coffee Corporation,El Salvador,2010
2005,7,1230.0,Los Pirineos,Los Pirineos S.A. De C.V.,"Berlín, Usulutan",88.84,,,7,8.4,22419.6,Maruyama Coffee for Mikatajuku group,El Salvador,2010
2006,8,1170.0,La Batalla #1,Guillermo Magaña Flores,"Santa Ana, Alotepec-Metap N",88.84,,,8,8.0,20544.0,"Mercanta the Coffee Hunters for Has Bean Coffee (UK), Inoue Coffee (JP), Rocket Coffee (NZ), Melbourne Coffee Merchants (AU), Kasai Coffee (JP) and Kean Coffee (USA)",El Salvador,2010
2007,9,1200.0,Las Mercedes,Francisco Giron Salazar Hijos Y Cia.,"Santa Ana, Apaneca-Ilamatepec",88.7,,,9,8.0,20712.0,"Seven Seeds, Mecca, and The Source",El Salvador,2010
2008,10,1200.0,Llano Grande,"Proyectos De Venta Y Compra, S.A. De C.V.","Ahuachapán, Apaneca-Ilamatepec",88.18,,,10,7.0,18305.0,TERAROSA(HAKSAN Co.Ltd),El Salvador,2010
2009,11,1620.0,La Pinera,Luis Alonso Araujo Padilla,"San Miguel, Cacahuatique",86.5,,,11,7.05,24935.85,"Café Imports, Terroir Coffee, The Coffee Tree Roasters, Madcap Coffee, PTs Coffee Roasting Co., Sweet Maria’s, Intelligentsia",El Salvador,2010
2010,12,1560.0,El Porvenir,Adilia Encarnación Aguilar de Pullinger,"San Miguel, Tecapa-Chinameca",86.3,,,12,6.1,20849.8,Firestorm Coffee Roasters Company,El Salvador,2010
2011,13,1350.0,Agabo,Adda Mercedes Serarols Diaz,"Ahuachapán, Apaneca-Ilamatepec",86.07,,,13,6.25,18243.75,Kaffebrenneriet as,El Salvador,2010
2012,14,1320.0,San Carlos,Carlos Alfredo Méndez Florez,"Ahuachapán, Apaneca-Ilamatepec",86.05,,,14,6.2,17688.6,"Wataru & Co., Ltd.",El Salvador,2010
2013,15,1260.0,Cerro Negro,Jose Armando Portillo Peraza,"La Palma, Chalatenango",85.95,,,15,6.3,17425.8,MARETERRA S.L.,El Salvador,2010
2014,16,1290.0,La Gloria/Nueva Granada,"Majo, Gloria and Luis Rodríguez","Ahuachapán, Apaneca-Ilamatepec",85.91,,,16,6.59,18438.82,"Barefoot Coffee Roasters, Inc.",El Salvador,2010
2015,17,1170.0,Santa Teresa I,"Marco Antonio Batres, Teresa Eugenia Giamattei Y C","Ahuachapán, Apaneca-Ilamatepec",85.7,,,17,5.95,15273.65,"C&C Co., Ltd.",El Salvador,2010
2016,18,1590.0,Casa De Zinc,"Casa De Zinc, S.A. De C.V.","Ahuachapán, Apaneca-Ilamatepec",85.18,,,18,5.65,19588.55,"Nippon Coffee Trading Co., Ltd.",El Salvador,2010
2017,19,1380.0,La Campánula,Sociadad Lima Y Socios,"Santa Ana, Apaneca-Ilamatepec",85.07,,,19,5.75,17158.0,Orsir Coffee (Taiwan),El Salvador,2010
2018,20,1530.0,Pinares 2,Héctor Manuel Velásquez Guzmán,"La Libertad, El Balsamo-Quetzaltepec",85.05,,,20,5.91,19963.98,"Tashiro Coffee Co.,Ltd",El Salvador,2010
2019,21,1620.0,Los Amates – Tablon Los…,"Finca Los Amates, S.A. De C.V.","Ahuachapán, Apaneca-Ilamatepec",85.05,,,21,6.1,21569.6,Wataru for Toho Coffee,El Salvador,2010
2020,22,1620.0,Divina Providencia,Roberto Samuel Ulloa Vilanova,"Santa Ana, Apaneca-Ilamatepec",85.05,,,22,6.05,21350.45,"Nippon Coffee Trading Co.,Ltd for Doi Coffee",El Salvador,2010
2021,23,1380.0,Villa Galicia – Lote…,"Pretoria, S.A. De C.V.","Ahuachapán, Apaneca-Ilamatepec",84.73,,,23,6.26,19024.14,Kyokuto Fadie Corporation,El Salvador,2010
2022,24,4350.0,Opalo,Daniel Ernesto Aguilar Zarco,"Ahuachapán, Apaneca-Ilamatepec",84.68,,,24,4.05,38742.3,honuKATOCOFFEE Inc.,El Salvador,2010
2023,25,1440.0,El Jocotillo,Anna Elaine Del Carmen Rivas De Vega,"Santa Ana, Apaneca-Ilamatepec",84.55,,,25,6.0,18684.0,"Wataru & Co., Ltd.",El Salvador,2010
2024,26,1500.0,Santa Barbara,"COEXCA, S.A. De C.V.","Santa Ana, Apaneca-Ilamatepec",84.45,,,26,5.95,19498.15,"Mercanta the Coffee Hunters for Twoday Coffee Roasters (UK), Åre Kafferosteri (SE), Giuli Co. Ltd. (TW), Has Bean Coffee (UK), Melbourne Coffee Merchants (AU), Andronicas Coffee (UK)",El Salvador,2010
2025,27,1500.0,Las Nubes I,Ernesto Lima Mena,"Sonsonate, Apaneca-Ilamatepec",84.39,,,27,6.0,19728.0,Mercanta the Coffee Hunters for Monmouth Coffee Company (UK),El Salvador,2010
2026,28,1530.0,El Milenio,Kristal S.A. De C.V.,"Ahuachapán, Apaneca-Ilamatepec",84.36,,,28,6.31,21094.33,"Time’s Club for C-COOP(JPN), COFFEE LIBRE(S.Korea)",El Salvador,2010
2027,29,1560.0,Miralvalle,Marta Dolores Menéndez De Riera,"Santa Ana, Apaneca-Ilamatepec",84.23,,,29,5.9,20231.1,M.I. Coffee Corporation,El Salvador,2010
2028,30,1320.0,Las Palmas,Los Pirineos S.A. De C.V.,"Usulutan, Tecapa-Chinameca",84.11,,,30,5.31,15478.65,Tim Wendelboe,El Salvador,2010
2029,1,1230.0,El Topacio,Maria Elena Avila Magaña De Muyshondt,"Juayúa, Sonsonate, Apaneca-Ilamatepec",91.68,,,1,22.25,69108.5,Wataru for C & C,El Salvador,2009
2030,2,1350.0,El Jocotillo Lote A,Anna Elaine Del Carmen Rivas De Vega,"Chalchuapa, Santa Ana, Apaneca-Ilamatepec",89.86,,,2,8.3,28087.2,"Maruyama Coffee for Mikatajuku group, Haneda Coffee – Pon Pon, Itoya Coffee, Orsir Coffee",El Salvador,2009
2031,3,1170.0,Fatima,Carmen Duch Martinez,"Santa Ana, Santa Ana, Apaneca-Ilamatepec",89.86,,,3,8.55,24820.65,"Time’s Club for C-COOP, Hisashi Yamamoto coffee",El Salvador,2009
2032,4,1110.0,Buenos Aires,"Calera, S.A. De C.V.","Metapán, Santa Ana, Alotepec-Metapán",89.61,,,4,5.75,16077.0,Kaffebrenneriet as,El Salvador,2009
2033,5,1650.0,La Batalla,Guillermo Magaña Flores,"Metapán, Santa Ana, Alotepec-Metapán",89.5,,,5,9.0,37233.0,Solberg & Hansen AS,El Salvador,2009
2034,6,1410.0,La Avila,"Ortiz Barriere, S.A. De C.V.","Santiago de María, Usulután , Tecapa-Chinameca",89.43,,,6,4.2,14708.4,"Toa Coffee Co., Ltd",El Salvador,2009
2035,7,1140.0,La Nueva,Rafael Duch Martinez,"Santa Ana, Santa Ana",89.43,,,7,6.05,17284.85,"KAFFA as, Oslo – Norway",El Salvador,2009
2036,8,990.0,Santa Teresa I,"Marco Batres, Teresa Giammattei Y Cia.","Ahuachapán, Ahuachapán, Apaneca-Ilamatepec",89.34,,,8,6.05,14852.75,"Nippon Coffee Trading Co.,Ltd for Doi Coffee",El Salvador,2009
2037,9,930.0,Santa Teresa IV -“Nicolas…,"Marco Batres, Teresa Giammattei Y Cia.","Ahuachapán, Ahuachapán, Apaneca-Ilamatepec",88.84,,,9,5.0,11450.0,Lofbergs Lila AB,El Salvador,2009
2038,10,1290.0,San Isidro,Ana Sylvia Elizabeth Schonenberg Aguiluz,"Alegría, Usulután, Tecapa-Chinameca",88.7,,,10,3.55,11505.55,"Bontain Coffee co.,Ltd.",El Salvador,2009
2039,11,1170.0,El Carmen,Juan Duch Martinez,"Santa Ana, Santa Ana, Apaneca-Ilamatepec",86.75,,,11,3.2,9292.8,"Coffeeplant, Momos Coffee, Song Hoon, Steven Kil",El Salvador,2009
2040,12,1290.0,Los Amates,Graciela Haydee Magaña De Fortin Magaña,"Jujutla, Ahuachapán, Apaneca-Ilamatepec Mountain Range",86.58,,,12,3.2,10409.6,"Has Bean Coffee, United Kingdom",El Salvador,2009
2041,13,2010.0,Villa España,Alfredo Antonio Mena Lagos,"Ataco, Ahuachapán, Apaneca-Ilamatepec",86.45,,,13,3.05,15469.6,"Ricardo Espitia Associates*- Sweet Maria’s, Ritual Coffee Roasters, Tony’s Coffee)- *Projected Profits Of $10,144 To Be Donated June 5th For The Speedy Recovery Of Ricardo Espitia",El Salvador,2009
2042,14,1260.0,El Torogoz,"Regpa, S. A. De C. V.","Santa Ana, Santa Ana, Apaneca-Ilamatepec",86.2,,,14,3.55,11147.0,"Wataru & Co., Ltd.",El Salvador,2009
2043,15,1260.0,San Jose / Shangrila,Juan Carlos Gregg Meza,"Apaneca, Ahuachapán, Apaneca-Ilamatepec",86.15,,,15,3.3,10315.8,"Mercanta The Coffee Hunters for Andronicas World of Coffee at Harrods UK, Inoue / Voila Coffee Japan, Has Bean Coffee UK, Melbourne Coffee Merchants Australia, Transcend Coffee Canada",El Salvador,2009
2044,16,1890.0,Monte Nevado,Regina De Carmen Meardi Zuniga De Papini,"Alegría, Usulután, Tecapa-Chinameca",86.08,,,16,2.7,12822.3,honuKATOCOFFEE Inc.,El Salvador,2009
2045,17,2070.0,El Optimismo,Socorro Martinez De Zepeda,"Alegría, Usulután, Tecapa-Chinameca",85.83,,,17,3.15,16483.95,"Nippon Coffee Trading Co.,Ltd for Doi Coffee",El Salvador,2009
2046,18,1110.0,San Jose,Gloria Mercedes Rodriguez Fontan,"Apaneca, Ahuachapán, Apaneca-Ilamatepec",85.78,,,18,2.95,8186.25,"Wataru & Co., Ltd.",El Salvador,2009
2047,19,930.0,Altamira I,"Marco Batres, Teresa Giammattei Y Cia.","Ahuachapán, Ahuachapán, Apaneca-Ilamatepec",85.78,,,19,3.1,7300.5,"T.A.N. Coffee, gimme!coffee, No Quarter Coffee",El Salvador,2009
2048,20,1350.0,Malacara Lote A,"Pergamino, S.A. De C.V.","Chalchuapa, Santa Ana, Apaneca-Ilamatepec",85.48,,,20,6.0,20334.0,"Wataru & Co., Ltd., Intelligentsia",El Salvador,2009
2049,21,1200.0,La Trinidad,Francisco Eduardo Nuñez Iraheta,"La Libertad, La Liibertad, El Bálsamo-Quetzaltepec",85.43,,,21,2.65,7971.2,"T.A.N. Coffee, No Quarter Coffee",El Salvador,2009
2050,22,1260.0,Buena Vista,Cia. Agr. Salvadoreña S.A. De C.V.,"Ahuachapán, Apaneca-Ilamatepec",85.3,,,22,3.45,10839.9,Kaffebrenneriet as,El Salvador,2009
2051,23,1680.0,Nombre De Dios San Juan,Maria Elena Dominguez De Botto Isassi,"Metapán, Santa Ana, Alotepec-Metapán",85.28,,,23,2.85,11975.7,honuKATOCOFFEE Inc.,El Salvador,2009
2052,24,1260.0,San Jose La Cumbre,Enma Duarte De Vasquez,"Santa Ana, Santa Ana, Apaneca-Ilamatepec Mountain Range",85.2,,,24,2.8,8895.6,"Wataru & Co., Ltd.",El Salvador,2009
2053,25,990.0,Altamira III – “Andres Peak”,"Marco Batres, Teresa Giammattei Y Cia.","Ahuachapán, Apaneca-Ilamatepec",85.15,,,25,2.8,6879.6,"T.A.N. Coffee, Canada; Invalsa Coffee®, Boston, US",El Salvador,2009
2054,26,2250.0,El Cashal,Maria Alicia Otilia Magaña Castillo,"Ahuachapán, Ahuachapán, Apaneca-Ilamatepec",84.8,,,26,2.8,15940.4,honuKATOCOFFEE Inc.,El Salvador,2009
2055,27,1170.0,La Montañita,Antonio Rene Aguilar Lemus,"La Palma, Chalatenango",84.78,,,27,3.4,10050.4,"Sweet Maria’s, Barefoot Coffee",El Salvador,2009
2056,28,1230.0,Santa Sofia,"Pacvil, S.A. De C.V.","Santa Ana, Santa Ana",84.6,,,28,2.9,8827.6,"Wataru & Co., Ltd.",El Salvador,2009
2057,29,1500.0,Nejapa – Tablon Roma,Gloria Mercedes Rodriguez Fontan,"Apaneca, Ahuachapán, Apaneca-Ilamatepec",84.53,,,29,2.65,10054.1,"Nippon Coffee Trading Co.,Ltd for Doi Coffee",El Salvador,2009
2058,30,1620.0,Los Planes – Lote La Lagunita,Sergio Edmundo Ticas Reyes,"Citalá, Chalatenango, Alotepec-Metapán",84.28,,,30,3.5,14112.0,"Mercanta The Coffee Hunters for Has Bean Coffee UK, Cartel Coffee USA, Inoue / Voila Coffee Japan, Kontra Coffee Denmark, Melbourne Coffee Merchants Australia, Rocket Coffee New Zealand, Kaffeespezialitat Austria, The Conservatory Coffee USA, New Orleans",El Salvador,2009
2059,31,1230.0,Helvetia,Carmen Elena Calderon Sol De Escalon,"Concepción de Ataco, Ahuachapan",84.25,,,31,2.65,8079.85,Kyokuto Fadie Corporation,El Salvador,2009
2060,32,1350.0,Malacara Lote B,"Chantuc, S.A. De C.V.","Santa Ana, Apaneca-Ilamatepec",84.23,,,32,2.75,9333.5,Arvid Nordquist HAB,El Salvador,2009
2061,33,2310.0,San Carlos,Amadeo Riera Y Solsona,"Santa Ana, Santa Ana, Apaneca-Ilamatepec",84.2,,,33,2.8,16371.6,honuKATOCOFFEE Inc.,El Salvador,2009
