,OBJRANK,WEIGHT(KG),FARM,FARMER/REPRESENTATIVE,REGION,SCORE,VARIETY,PROCESS,NUMRANK,HIGH_BID,TOTAL_VALUE,BUYERS,COUNTRY,YEAR
2833,19,930.0,Zapote Verde,Pedro Pineda Hernández,"La Cuesta, Santa Bárbara",85.29,,,19,4.2,8593.2,T.A.N. Coffee,Honduras,2011
2834,20,990.0,El Aguacatal,Javier Antonio Santos,"El Común, La Paz",85.29,,,20,4.3,9365.4,"Nippon Coffee Trading Co.,Ltd",Honduras,2011
2835,21,1380.0,Shemy,Nelson Ramírez Sosa,"El Cielito, Santa Bárbara",85.26,,,21,4.0,12144.0,honuKATOCOFFEE Inc.,Honduras,2011
2836,22,1350.0,Las Pajapas,Jorge Rivera López,"Pajapas, Lempira",85.24,,,22,4.0,11880.0,Solberg & Hansen AS,Honduras,2011
2837,23,1350.0,El Cedral,José Rumaldo Moreno,"El Cedral, Santa Bárbara",85.24,,,23,4.2,12474.0,"Wataru & Co., Ltd.",Honduras,2011
2838,24,990.0,Javier,José Javier Fernández,"El Cielito, Santa Bárbara",85.21,,,24,4.2,9147.6,Kaffebrenneriet as,Honduras,2011
2839,25,1110.0,San Nicólas,Amado Turcios Benítez,"San Nicolás, Intibucá",85.21,,,25,4.2,10256.4,Kaffebrenneriet as,Honduras,2011
2840,26,1140.0,Los Tróchez,Carlos Misael Tróchez,"Las Flores, Santa Bárbara",84.85,,,26,4.0,10032.0,honuKATOCOFFEE Inc.,Honduras,2011
2841,27,1320.0,El Capucal,Jorge Mendoza,"San Luís Planes, Santa Bárbara",84.82,,,27,4.0,11616.0,"MI Coffee coporation for EL CAFE coffee roasters, CoffeeRadio, Caffe Themselves, Design Coffee Roasters, Told A Story, CHOI coffee/seoul barista school",Honduras,2011
2842,28,1290.0,El Aguacate,José Nahúm Fernández,"Las Flores, Santa Bárbara",84.79,,,28,4.0,11352.0,Kaffebrenneriet as,Honduras,2011
2843,29,1320.0,Miguel Angel,Miguel Ángel Guzmán,"El Cielito, Santa Bárbara",84.79,,,29,4.0,11616.0,Solberg & Hansen AS,Honduras,2011
2844,30,810.0,Cerro Oscuro Lote 1,Manuel de Jesús Villeda,"Gualan, Lempira",84.68,,,30,4.6,8197.2,Kyokuto Fadie Corporation,Honduras,2011
2845,31,1320.0,Don Medardo,Medardo Sagastume,"El Sauce, Santa Bárbara",84.18,,,31,4.0,11616.0,honuKATOCOFFEE Inc.,Honduras,2011
2846,32,1230.0,La Granadilla,Omar Gómez Benítez,"Cangual, Intibucá",84.09,,,32,4.1,11906.4,Sandalj Trading Company,Honduras,2011
2847,33,600.0,El Maragogipe,Evelio Flores Hernández,"Mercedes, Lempira",84.0,,,33,4.9,6468.0,"Wataru & Co., Ltd.",Honduras,2011
2848,1,1290.0,Don Amado,José Amado Fernández Fernández,"El Cielito, Santa Bárbara",91.45,,,1,22.05,62577.9,"Time’s Club for C-COOP, Hisashi Yamamoto Coffee(Unir), Your Coffee (JPN) , COFFEE LIBRE (S. Korea)",Honduras,2010
2849,2,1290.0,Las Manos,Santos Alexis Domínguez Ramos,"El Cielito, Santa Bárbara",90.45,,,2,9.6,27244.8,Maruyama Coffee for Mikatajuku group,Honduras,2010
2850,3,1110.0,Pino De Oro,Oscar Edgardo Tinoco Madrid,"Ojo De Aguita, Santa Bárbara",89.7,,,3,13.5,32967.0,St Ali Pty Ltd & Sensory Lab Pty Ltd,Honduras,2010
2851,4,1320.0,Fernández,Cesar Agusto Fernández Fernández,"El Cielito, Santa Bárbara",89.7,,,4,10.25,29766.0,"Royal Coffee NY, Café Grumpy, Rojo’s Roastery",Honduras,2010
2852,5,990.0,Olvin,Olvin Esmelin Fernández Paz,"El Cielito, Santa Bárbara",89.6,,,5,10.16,22128.48,Kaffebrenneriet as,Honduras,2010
2853,6,1470.0,El Filo,Miguel Moreno Leiva,"El Cedral, Santa Bárbara",89.3,,,6,8.05,26033.7,Volcafe Specialty and COFI-COM Trading PTY LTD,Honduras,2010
2854,7,1260.0,Los Portillos,Adolfo Reyes Portillo,"El Cielito, Santa Bárbara",88.35,,,7,10.1,27997.2,"Royal Coffee NY, No Quarter Coffee",Honduras,2010
2855,8,840.0,Las Amazonas,Ezri Moisés Herrera Urizar,"La Piedrona, La Paz",88.2,,,8,8.05,14876.4,"Royal Coffee NY, Dallis Bros Coffee",Honduras,2010
2856,9,840.0,El Aguacate,Luis Alfonzo Hernández Aguilar,"El Sauce, Santa Bárbara",86.9,,,9,7.15,13213.2,"Toa Coffee Co., Ltd",Honduras,2010
2857,10,1170.0,Finca Bu,Pompilio Ramos Archila,"El Cielito, Santa Bárbara",86.8,,,10,7.7,19819.8,Cafe Imports,Honduras,2010
2858,11,750.0,El Sauce,Esteban Madrid Chávez,"Santa Bárbara, Santa Bárbara",86.75,,,11,7.1,11715.0,"Royal Coffee NY, Kobrick’s Coffee Co., Rojo’s Roastery, No Quarter Coffee",Honduras,2010
2859,12,1590.0,El Campo,Daniel Moreno,"El Cedral, Santa Bárbara",86.55,,,12,6.65,23261.7,Solberg & Hansen AS,Honduras,2010
2860,13,1140.0,Las Cascadas,Jorge Alberto Vallecillo Yánez,"El Común, La Paz",86.4,,,13,7.85,19687.8,Solberg & Hansen AS,Honduras,2010
2861,14,870.0,El Gran Sauce,Claudio Lenin Madrid Villanueva,"El Sauce, Santa Bárbara",86.0,,,14,7.05,13493.7,M.I. Coffee Corporation,Honduras,2010
2862,15,750.0,Linda Vista,Joel Guzmán Muñoz,"El Cielito, Santa Bárbara",85.6,,,15,7.05,11632.5,"Wataru & Co., Ltd.",Honduras,2010
2863,16,1020.0,Angelina Lote No. 15 El Pacon,COFEVASA,"El Pacon, El Paraíso",85.35,,,16,6.45,14473.8,"Tashiro Coffee Co.,Ltd",Honduras,2010
2864,17,840.0,La Burra,Jorge Alberto Lanza Ordoñez,"Lomas Limpias, El Paraíso",85.25,,,17,6.9,12751.2,Carrboro Coffee Roasters and Bard Coffee,Honduras,2010
2865,18,1080.0,Cielito Lindo,Extreberto Cáceres,"El Cielito, Santa Bárbara",85.1,,,18,8.1,19245.6,Tim Wendelboe,Honduras,2010
2866,19,2040.0,La Sultana,Héctor Manuel Mata,"La Sultana, Ocotepeque",85.05,,,19,6.7,30069.6,"Löfbergs Lila AB, Irma A/S and Crema Kaffebrenneri AS",Honduras,2010
2867,20,750.0,Buena Vista,Pedro Pineda Hernández,"La Cuesta, Santa Bárbara",84.8,,,20,7.0,11550.0,Paul Verbunt Koffie BV,Honduras,2010
2868,21,1290.0,Copo Mico,Mariano Alejandro Mejía Quirós,"San Luis Planes, Santa Bárbara",84.5,,,21,6.56,18617.28,"Wataru & Co., Ltd.",Honduras,2010
2869,22,960.0,Angelina (Lote No. 16),Mario Edgardo Segura Aroca,"El Pacon, El Paraíso",84.5,,,22,7.05,14889.6,"Nippon Coffee Trading Co.,Ltd",Honduras,2010
2870,23,1140.0,La Granadilla,Omar Gómez Benítez,"Cangual, Intibucá",84.4,,,23,6.55,16427.4,"Wataru & Co., Ltd.",Honduras,2010
2871,24,1410.0,Las Peñitas,Jorge Arturo Benítez Miranda,"El Ocotillo, Santa Bárbara",84.2,,,24,6.58,20411.16,"gimme! coffee, Invalsa Coffee® and Sviezia Kava",Honduras,2010
2872,25,1230.0,Martínez,Mártir Fernández,"El Cielito, Santa Bárbara",84.1,,,25,6.56,17725.12,Kaffebrenneriet as,Honduras,2010
2873,1,750.0,Portillo,Bertilio Reyes Portillo,"El Cielito, Santa Bárbara",90.75,,,1,18.75,35643.75,Kyokuto Fadie Corporation,Honduras,2009
2874,2,780.0,El Nacimiento,Jobneel Cáceres Díaz,"El Cielito, Santa Bárbara",90.3,,,2,13.6,26900.8,"Maruyama Coffee for Mikatajuku group, Yokoi Coffee",Honduras,2009
2875,3,900.0,El Manzano,Teodoro Amaya Montoya,"Cedritos, La Paz",89.27,,,3,8.6,19625.2,49th Parallel Roasters Inc.,Honduras,2009
2876,4,900.0,Los Higueros,Emeterio Pérez,"Los Higueros, Yoro",89.27,,,4,7.0,15974.0,Time’s Club for C-COOP,Honduras,2009
2877,5,780.0,Cielito Lindo,Extreberto Cáceres Gutiérrez,"El Ocotillo, Santa Bárbara",89.23,,,5,12.05,23834.9,Tim Wendelboe,Honduras,2009
2878,6,1080.0,Don Amado,José Amado Fernández Fernández,"El Cielito, Santa Bárbara",89.09,,,6,6.05,16564.9,"Toa Coffee Co., Ltd",Honduras,2009
2879,7,1050.0,El Filo,Miguel Moreno Leiva,"El Cedral, Santa Bárbara",89.02,,,7,6.76,17995.12,Kaffebrenneriet as,Honduras,2009
2880,8,900.0,Fernández,Cesar Augusto Fernández Fernández,"El Cielito, Santa Bárbara",88.95,,,8,6.7,15289.4,"Ritual Coffee Roasters, LLC, Sweet Maria’s",Honduras,2009
2881,9,1110.0,Moreno,Pedro Moreno,"El Cedral, Las Vegas, Santa Barbara",88.45,,,9,7.31,20570.34,Solberg & Hansen for Stockfleths,Honduras,2009
2882,10,1320.0,Montecios,Wilmer Alexis Grau Montoya,"Poso Negro, Intibucá",88.07,,,10,4.45,14894.15,"Nippon Coffee Trading Co.,Ltd for Doi Coffee",Honduras,2009
2883,11,1200.0,San Jorge,Otilio Hernández Cáceres,"Cedritos, La Paz",87.11,,,11,3.55,10799.1,Mecca,Honduras,2009
2884,12,510.0,El Triunfo,Renán Amilcar Bajurto,"El Paraíso, Ocotepeque",87.07,,,12,4.5,5818.5,"The Roasterie Inc., Cultiva, Coffee Roasters of New Orleans, The Roastery Inc., Montana Coffee Traders",Honduras,2009
2885,13,510.0,Sesesmile,Nelson Rafael Guerra,"Sesesmiles, Ocotepeque",86.66,,,13,5.0,6465.0,Has Bean Coffee UK,Honduras,2009
2886,14,900.0,El Juniapal,Delcis Rodríguez,"El Cielito, Santa Bárbara",86.59,,,14,7.36,16795.52,Solberg & Hansen AS,Honduras,2009
2887,15,1380.0,Liquidambar,Reina Mercedes Claros Bautista,"El Centro, Intibucá",86.39,,,15,2.6,9097.4,"Nippon Coffee Trading Co.,Ltd for Doi Coffee",Honduras,2009
2888,16,1440.0,Miravalle,Miroslav Cuculiza,"Guaslaca, Francisco Morazán",86.36,,,16,4.1,14969.1,"Wataru & Co., Ltd.",Honduras,2009
2889,17,600.0,La Pedrera,Francisco Moran,"El Granzal, Ocotepeque",86.36,,,17,4.4,6692.4,Mecca,Honduras,2009
2890,18,1200.0,Santa Martha,Cristina Chirino Caballero,"Tegucigalpita, Yoro",86.34,,,18,3.7,11255.4,honuKATOCOFFEE Inc.,Honduras,2009
2891,20,930.0,Los Pinos,Lucas Orlando Carballo Castillo,"El Roblon, Lempira",86.18,,,20,2.85,6720.3,"Wataru & Co., Ltd.",Honduras,2009
2892,21,780.0,Los Tres Juanes,Miguel Angel Guzmán Zaldivar,"El Cielito, Santa Bárbara",86.16,,,21,3.3,6527.4,NAGAHAMA COFFEE Inc.,Honduras,2009
2893,22,1080.0,El Aguacate,Tomas Sosa Calderón,"San Jeronimo, Comayagua",86.14,,,22,3.5,9583.0,Carrboro Coffee Roasters,Honduras,2009
2894,23,960.0,Las Manos,Santos Alexis Domínguez Ramos,"El Cielito, Santa Bárbara",86.07,,,23,2.7,6571.8,Wataru for Ogawa Coffee,Honduras,2009
2895,24,1140.0,El Común,Jorge Alberto Vallecillo Yanez,"Santiago De Puringla, La Paz",85.93,,,24,2.7,7803.0,JuBean Coffee,Honduras,2009
2896,25,600.0,El Pinabetal,Saúl Melara Santos,"El Pinal, Ocotepeque",85.91,,,25,3.65,5551.65,Carrboro Coffee Roasters,Honduras,2009
2897,26,1380.0,El Pino,Isidro Bejarano,"Cangual, Intibucá",85.89,,,26,2.7,9447.3,"Nippon Coffee Trading Co.,Ltd",Honduras,2009
2898,27,1680.0,San Juan,Tulio Adalberto Portillo Chinchilla,"El Portillo, Intibucá",85.68,,,27,4.05,17248.95,"Nippon Coffee Trading Co.,Ltd for Doi Coffee",Honduras,2009
2899,28,900.0,La Guinellera,Miguel Angel Ortiz Vega,"Las Flores, Santa Bárbara",85.64,,,28,3.55,8101.1,Kaffebrenneriet as,Honduras,2009
2900,29,1140.0,Las Nueve Posas,Fernando Obdulio Espinoza,"Santa Marta, Ocotepeque",85.59,,,29,3.05,8814.5,Kasai coffee for C-COOP,Honduras,2009
2901,30,870.0,San Andrés,Andrés Fernández Madrid,"El Cielito, Santa Bárbara",85.45,,,30,2.7,5956.2,"Wataru & Co., Ltd.",Honduras,2009
2902,31,780.0,Bu,Pompilio Ramos Archila,"El Cielito, Santa Bárbara",85.36,,,31,3.5,6923.0,Blue Bottle Coffee Co.,Honduras,2009
2903,32,900.0,Linda Vista,Joel Guzmán Muñoz,"El Cielito, Santa Bárbara",85.3,,,32,2.65,6047.3,gimme! coffee,Honduras,2009
2904,33,1470.0,Las Cascadas,Wilmer Arturo Maldonado Lote 1,"Cangual, Intibucá",85.23,,,33,2.5,9317.5,honuKATOCOFFEE Inc.,Honduras,2009
2905,34,1080.0,Sesesmiles,José Orlando Santos,"Sesesmiles, Ocotepeque",84.95,,,34,2.6,7118.8,Gala Coffee Limited,Honduras,2009
2906,35,1500.0,La Cumbre,Pedro Antonio Martínez,"Buenos Aires, El Paraíso",84.75,,,35,2.75,10458.25,honuKATOCOFFEE Inc.,Honduras,2009
2907,36,1620.0,La Montaña,Tatiana Isabel Lara,"Guacamaya, Francisco Morazán",84.66,,,36,4.6,18892.2,Kaffebrenneriet as,Honduras,2009
2908,38,1590.0,La Pedrera,José Salomón Benítez Aguilar,"Cangual, Intibucá",84.39,,,38,2.65,10682.15,"Wataru & Co., Ltd.",Honduras,2009
2909,39,1080.0,Yaquelin,Genaro Aguilar Nolasco LOTE 1,"Barrio Nuevo, Intibucá",84.16,,,39,2.55,6981.9,"Maruyama Coffee for Mikatajuku group, Yokoi Coffee",Honduras,2009
2910,1,450.0,El Sauce II,Franklin Adonis Madrid Lote 2,"El Sauce, Sta. Barbara, Santa Barbara",90.76,,,1,16.65,37991.71,"Time’s Club for C-COOP, Kyokuto Fadie Corporation",Honduras,2008
2911,2,390.0,Moreno,Pedro Moreno,"El Cedral, Las Vegas, Santa Barbara",90.57,,,2,15.35,30355.34,"Maruyama Coffee for Mikatajuku group, Honey Coffee, Sugi Coffee Roasting Co, and Orsir Coffee",Honduras,2008
2912,3,570.0,El Campo,Miguel Moreno Leiva lote 2,"El Cedral, Las Vegas, Santa Barbara",89.86,,,3,12.4,35839.23,Solberg & Hansen AS,Honduras,2008
2913,4,390.0,Cielito Lindo,Extreberto Cáceres Gutíerrez,"El Cielito, El Ocotillo, Santa Bárbara",89.05,,,4,14.0,27685.65,Tim Wendelboe,Honduras,2008
2914,5,450.0,La Mora,Servando Galo Rodríguez Lote 1,"Santiago de Puringla, La Paz",88.71,,,5,10.1,23046.02,A/S Pals,Honduras,2008
2915,6,450.0,Chichicastal,Servando Galo Rodríguez Lote 2,"Santiago de Puringla, La Paz",88.29,,,6,7.15,16314.76,Kaffebrenneriet as,Honduras,2008
2916,7,450.0,Portillo,Bertilio Reyes Portillo,"El Cielito, Santa Bárbara",88.05,,,7,13.26,30256.46,"Snitt for Ritual Coffee Roasters, KAFFA as, Oslo, Bird Rock Coffee Roasters",Honduras,2008
2917,8,660.0,La Montaña,Tatiana Lara,"Not Available, Not Available",87.67,,,8,5.55,18573.73,Nippon Coffee Trading for Doi Coffee,Honduras,2008
2918,9,330.0,La Guinellera,Miguel Angel Ortíz Vegas Lote 1,"Las Flores, Santa Barbara",87.62,,,9,6.4,10709.17,"TOA COFFEE Co.,Ltd.",Honduras,2008
2919,10,300.0,El Joconal,Wilmer Paz Hernández,"La Union, Lempira",87.1,,,10,8.0,12169.52,Bewleys Ltd,Honduras,2008
2920,11,480.0,El Filo,Miguel Moreno Leiva lote 1,"El Cedral, Las Vegas, Santa Barbara",86.43,,,11,5.55,13508.16,Kaffebrenneriet as,Honduras,2008
2921,12,450.0,La Piñona,Sebastian Benitez,"El Cielito, Santa Barbara",86.38,,,12,8.7,19851.52,Solberg & Hansen AS,Honduras,2008
2922,13,300.0,Cerro Obscuro,Manuel de Jesús Villeda,"Lepaera, Lempira",86.1,,,13,6.6,10039.85,Solberg & Hansen AS,Honduras,2008
2923,14,480.0,Guzmán,Ramiro Guzmán,"El Cielito, Santa Barbara",86.1,,,14,5.55,13508.16,San Antonio Coffee Roasters,Honduras,2008
2924,15,480.0,Las Manos,José Misael Caballero,"El Cielito, Santa Barbara",86.1,,,15,4.85,11804.43,Nippon Coffee Trading for Doi Coffee,Honduras,2008
2925,16,510.0,EL Plan,Franklin Adonis Madrid Lote 1,"San Luis Planes, Santa Barbara",86.0,,,16,5.0,12930.11,"Wataru & Co., Ltd.",Honduras,2008
2926,17,570.0,Fernández,Cesar Agusto Fernández Fernández,"El Cielito, Santa Barbara",85.9,,,17,4.0,11561.04,Kyokuto Fadie Corporation,Honduras,2008
2927,18,540.0,San José,José Arnold Paz Mejía,"Alianza, Colinas, Santa Barbara",85.86,,,18,6.25,17113.38,"Mareterra, S.L. Sostenibilidad Y Trazabilidad",Honduras,2008
2928,19,540.0,El Filo II,Jesús Geovany Moreno Leiva,"El Cedral, Las Vegas, Santa Barbara",85.52,,,19,3.05,8351.33,"Wataru & Co., Ltd.",Honduras,2008
2929,20,450.0,Rio Helado,Manuel Antonio Tróchez Baide,"Santa Barbara, Santa Barbara",85.29,,,20,4.85,11066.65,Wataru for Gabee Yang,Honduras,2008
2930,21,570.0,Oropendulas,Desiderio Vásquez,"Belen, Ocotepeque",85.24,,,21,3.56,10289.33,"Tashiro Coffee Co.,Ltd",Honduras,2008
2931,22,420.0,Don Juan,Juan de la Cruz Teruel Guzmán,"El Cielito, Santa Barbara",84.86,,,22,4.95,10541.84,Russian coffee Company Ltd for SFT Trading Russia,Honduras,2008
2932,23,480.0,El Alba,Alba Leticia Ochoa Camacho,"Jesus de Otoro, Intibuca",84.71,,,23,3.6,8762.05,Wataru for Nagahama Coffee,Honduras,2008
2933,24,360.0,Santa Clara,Raúl Manueles,"Chinacla, La Paz",84.67,,,24,4.85,8853.32,Espresso Americano S.A. Honduras,Honduras,2008
2934,25,630.0,Agapantos,Rafael de Jesús Chinchilla Chinchilla,"Valle de Angeles, Francisco Morazan",84.38,,,25,3.61,11532.14,"Wataru & Co., Ltd.",Honduras,2008
2935,26,390.0,Las Amazonas,Erzi Moises Herrera Urizar,"Chinacla, La Paz",84.33,,,26,5.05,9986.61,"Fratello Coffee Co, Portland Roasting Company",Honduras,2008
2936,1,360.0,El Buen Pastor,Luis Enrique Vega,"Siguatepeque, Comayagua",92.25,,,1,18.7,34135.49,Solberg & Hansen AS,Honduras,2007
2937,2,390.0,Cielito Lindo,Extreberto Cáceres Gutíerrez,"El Cielito, El Ocotillo, Santa Bárbara",91.75,,,2,8.7,17204.65,Stumptown Coffee Roasters and Sweet Maria’s,Honduras,2007
2938,3,570.0,Mogola,Francisco Edgardo Urquia Aguilar,"Marcala, La Paz",91.28,,,3,7.05,20376.33,"Maruyama Coffee for Mikatajuku group, Inoue Coffee, Ponpon Coffee, Orsir Coffee",Honduras,2007
2939,4,540.0,El Filo,Miguel Moreno Leiva,"El Cedral, Santa Bárbara",90.59,,,4,6.3,17250.29,"Atlas Coffee Importers, LLC, Zoka Coffee Roasters, Hood River Coffee Co., 49th Parallel Coffee Roasters, Johnson Brothers Coffee Roasters, Montana Coffee Traders",Honduras,2007
2940,5,420.0,El Sauce II,Franklin Adonis Madrid Villanueva,"Santa Barbara, Santa Barbara",90.19,,,5,8.1,17250.29,Time’s Club for C-COOP,Honduras,2007
2941,6,540.0,Mira Valle,Miroslav Cuculiza,"Guiamaca, Francisco Morazan",90.09,,,6,5.55,15196.68,Bewleys Ltd,Honduras,2007
2942,7,480.0,La Piñona,Sebastian Benitez,"El Cielito, Santa Barbara",89.56,,,7,8.01,19495.57,"Ritual Coffee Roasters, LLC",Honduras,2007
2943,8,720.0,El Aguacate,Tomas Sosa Calderón,"San Jeronimo, Comayagua",88.84,,,8,4.05,14785.96,"Toa Coffee Co.,Ltd.",Honduras,2007
2944,9,600.0,Los Duraznos,Filiberto Ruiz Velasquez,"Lepaera, Lempira",88.06,,,9,5.31,16155.03,Nippon Coffee Trading for Doi Coffee,Honduras,2007
2945,10,630.0,Yaruchel,Timoteo Hernandez,"Belen Gualcho, Ocotepeque",86.44,,,10,5.06,16164.16,"Coffee Bean International, Inc.",Honduras,2007
2946,11,720.0,La Montaña,Tatiana Isabel Lara Pineda,"Distrito Central, Francisco Morazan",86.38,,,11,4.1,14968.51,"Wataru & Co., Ltd.",Honduras,2007
2947,12,630.0,La Mora,Serbando Galo Rodriguez Lote 1,"Santiago De Puringla, La Paz",86.09,,,12,3.75,11979.37,"Atlas Coffee Importers, A Hill of Beans",Honduras,2007
2948,13,630.0,Las Mujeres,Maria Irma Gutierrez Hernandez,"Distrito Central, Francisco Morazan",85.81,,,13,4.03,12873.83,Kaffebrenneriet as,Honduras,2007
2949,14,450.0,Santa Isabel,Sandra Isabel Garcia Argueta,"Marcala, La Paz",85.59,,,14,5.2,11865.28,Stumptown Coffee Roasters,Honduras,2007
2950,15,510.0,Nueve Posas,Fernando Obdulio Espinoza Mejia,"San Marcos, Ocotepeque",85.09,,,15,4.15,10731.99,Coffee Tree Roasters and Rosetta Coffee,Honduras,2007
2951,16,480.0,El Ventarron,Manuel Benitez Pascual,"San Marcos Caiquin, Copan",85.03,,,16,4.3,10465.78,GBT,Honduras,2007
2952,17,570.0,Nuevo Progreso,Jose Efren Acosta Molina,"Gracias, Lempira",84.94,,,17,4.05,11705.55,Wataru for Capital Corporation,Honduras,2007
2953,18,570.0,Juancito,Dagoberto Suazo Zelaya Lote 2,"Distrito Central, Francisco Morazan",84.59,,,18,4.06,11734.46,"Nippon Coffee Trading Co., Ltd",Honduras,2007
2954,19,630.0,La Represa,Isidro Acosta Molina,"San Marcos Caiquin, Copan",84.56,,,19,3.15,10062.67,"Wataru & Co., Ltd.",Honduras,2007
2955,20,480.0,El Supte,Jose Omar Calderon Romero,"Corquin, Copan",84.56,,,20,4.55,11074.26,Espresso Americano,Honduras,2007
2956,21,570.0,El Padre,Antonio Guevara Muñoz,"San Marcos Caiquin, Copan",84.41,,,21,3.55,10260.42,"Wataru & Co., Ltd.",Honduras,2007
2957,22,630.0,Chandalac,Saul Dominguez Gutierrez,"San Juan De Flores, Francisco Morazan",84.09,,,22,3.3,10541.84,Katocoffee Inc.,Honduras,2007
2958,23,450.0,El Naciente,Victor Manuel Perez Archila,"La Iguala, Lempira",84.03,,,23,4.3,9811.67,Russian Coffee Company Ltd for SFT Trading Ltd,Honduras,2007
2959,24,540.0,La Fortuna,Dionicio Sanchez Ramos,"San Juan, Intibuca",84.0,,,24,4.0,10952.57,Has Bean Coffee Ltd,Honduras,2007
2960,1,780.0,Santa Martha,Munir Hawit,"Victoria, Yoro",91.41,,,1,6.7,26499.12,"Maruyama Coffee for Mikatajuku group, Stumptown Coffee Roasters, Kaffa AS (Oslo)",Honduras,2006
2961,2,600.0,Las Barreras,Jose Anael Guevara Ramirez,"San Marcos Caiquin, Lempira",91.36,,,2,4.2,12777.99,49th Parallel Roasters Inc.,Honduras,2006
2962,3,480.0,El Pezote,Jose Geovany Martinez,"Lepaera, Lempira",90.36,,,3,6.2,15090.2,"Maruyama Coffee for Mikatajuku group, Yamada Coffee, Stumptown Coffee Roasters and Intelligentsia",Honduras,2006
2963,4,480.0,La Montaña,Tatiana Isabel Lara Pineda,"Distrito Central, Francisco Morazan",90.14,,,4,7.0,17037.32,"Stumptown Coffee Roasters, Sweet Marias, Intelligentsia, Terrior and Breaking New Grounds",Honduras,2006
2964,5,480.0,Rio Helado,Manuel Antonio Tróchez Baide,"Santa Barbara, Santa Barbara",89.86,,,5,5.75,13994.94,Kaffebrenneriet AS,Honduras,2006
2965,6,750.0,La Montañita,Nicolas Acosta,"San Marcos De Caiquin, Lempira",89.73,,,6,4.15,15782.34,Solberg & Hansen AS,Honduras,2006
2966,7,810.0,El Ocotillo,Elio Banegas Valle,"Yuscaran, El Paraiso",89.59,,,7,4.05,16634.21,"Toa COffee Co.,Ltd.",Honduras,2006
2967,8,480.0,El Puente,Marysabel Caballero,"Chinacla, La Paz",88.91,,,8,7.95,19349.53,"Stumptown Coffee Roasters, Intelligentsia, Counter Culture",Honduras,2006
2968,9,720.0,Jireh,Jose Orlando Arita,"La Labor, Ocotepeque",88.09,,,9,3.25,11865.28,"Nippon Coffee Trading Co., Ltd.",Honduras,2006
2969,10,780.0,El Bachan,Rafel Banegas,"Yuscaran, El Paraiso",87.45,,,10,2.3,9096.71,Gala Coffee and Tea Ltd on behalf of Waitrose Ltd,Honduras,2006
2970,11,510.0,Yaquelin,Genaro Aguilar Nolasco,"San Juan, Intibuca",85.73,,,11,6.0,15516.13,Mercanta The Coffee Hunters for Kaffitár (Iceland) and Cafés el Magnífico (Spain),Honduras,2006
2971,12,360.0,El Común,Jorge Alberto Vallecillo Yanez,"Santiago De Puringla, La Paz",85.59,,,12,5.7,10404.94,Stumptown Coffee Roasters and Sweet Marias,Honduras,2006
2972,13,810.0,Sesesmile,Nelson Rafael Guerra Chinchilla,"La Encarnacion, Ocotepeque",85.59,,,13,2.96,12157.35,Solberg & Hansen AS,Honduras,2006
2973,14,360.0,Los Duraznos,Filiberto Ruiz Velasquez,"Lepaera, Lempira",85.59,,,14,3.55,6480.27,Russian Coffee Company Ltd for SFT Trading Ltd,Honduras,2006
2974,15,810.0,El Eden,Raul Callejas Weitnauer,"Santa Lucia, Francisco Morazan",85.59,,,15,3.15,12937.72,49th Parallel Roasters Inc.,Honduras,2006
2975,16,480.0,Mantepeque,Soledad Pinto Mejia,"Corquin, Copan",85.55,,,16,3.2,7788.49,Kaffebrenneriet AS,Honduras,2006
2976,17,690.0,El Zanjon,Azucena Caballero Moreno,"San Jose De Colinas, Santa Barbara",85.45,,,17,1.85,6472.66,Caffe Pronto Coffee Roastery,Honduras,2006
2977,18,840.0,Lomas Cangual El Naranjit,Emiliano Navarrete Aguilar,"San Juan, Intibuca",85.36,,,18,2.01,8561.26,Katocoffee Inc.,Honduras,2006
2978,19,630.0,El Sauce I,Esteban Madrid Chavez,"Santa Barbara, Santa Barbara",85.36,,,19,1.81,5782.04,Katocoffee Inc.,Honduras,2006
2979,20,510.0,El Sauce,Saul Dominguez Gutierrez,"Tegucigalpa, Francisco Morazan",85.09,,,20,2.07,5353.07,49th Parallel Roasters Inc.,Honduras,2006
2980,21,630.0,El Liquidambar,Jose Dolores Santos Castillo,"Ajuterique, Comayagua",85.05,,,21,2.15,6868.17,"Wataru & Co., Ltd.",Honduras,2006
2981,22,450.0,La Mora,Servando Galo Rodríguez,"Santiago De Puringla, La Paz",84.82,,,22,2.65,6046.73,"Cafe Imports, Coffee Tree Roasters, Torreo Coffee, Hunter Bay and Crescent Moon Coffee",Honduras,2006
2982,23,450.0,Las Mujeres,Maria Irma Gutierrez Hernandez,"Distrito Central, Francisco Morazan",84.82,,,23,2.7,6160.82,"Arab Coffee Co., Ltd",Honduras,2006
2983,24,450.0,Altos De La Laguna,Benjamin Gomez Castillo,"Jesus De Otoro, Intibuca",84.5,,,24,1.9,4335.39,Wataru for Beans Coffee Sales,Honduras,2006
2984,25,540.0,Vista Hermosa,Wilmer Dubon Caballero,"Santa Barbara, Santa Barbara",84.32,,,25,3.35,9172.77,Bettys and Taylors of Harrogate,Honduras,2006
2985,26,510.0,Los Agapantos,Rafael De Jesus Chinchilla Chinchilla,"Valle De Angeles, Francisco Morazan",84.32,,,26,2.15,5559.95,Mercanta The Coffee Hunters for The Empire Group – Has Bean (England) and Bailies Coffee Co. (N Ireland),Honduras,2006
2986,27,450.0,Los Girasoles,Miguel Angel Rodriguez Escobar,"Belen, Lempira",84.32,,,27,1.55,3536.77,Coffee Meikan,Honduras,2006
2987,28,450.0,Alba,Alba Leticia Ochoa Camacho,"Jesus De Otoro, Intibuca",84.27,,,28,1.75,3993.12,"Wataru & Co., Ltd.",Honduras,2006
2988,29,540.0,El Suptal,Jose Omar Calderon Romero,"Corquin, Copan",84.23,,,29,1.75,4791.75,"The Roasterie, Cafe Belmondo, Atomic Cafe, Rocket Coffee Roasters, Hunter Bay and Bare Beans",Honduras,2006
2989,30,420.0,Las Amazonas,Ezry Moises Herrera,"Chinacla, La Paz",84.09,,,30,1.8,3833.4,"Kaffe AS (Oslo), Maruyama Group",Honduras,2006
2990,31,450.0,Cerro Oscuro,Manuel De Jesus Villeda Portillo,"Lepaera, Lempira",84.05,,,31,2.55,5818.55,"Wataru & Co., Ltd.",Honduras,2006
2991,32,450.0,Moreno,Pedro Moreno,"El Cedral, Las Vegas, Santa Barbara",84.0,,,32,1.6,3650.86,"Wataru & Co., Ltd.",Honduras,2006
2992,33,810.0,Montepeque,Marco Antonio Landaverde,"Corquin, Copan",84.0,,,33,1.6,6571.54,Timothy’s World Coffee,Honduras,2006
2993,1,450.0,El Ocotillo,Natividad Benitez Benitez,"Santa Barbara, Santa Barbara",92.48,,,1,17.6,40159.41,"Maruyama Coffee for Mikatajuku group Mocca kaffebar & brenneri, Oslo",Honduras,2005
2994,2,450.0,El Puente,Marysabel Caballero Garcia Lote # 2,"Chinacla, La Paz",92.03,,,2,5.25,11979.37,"Stumptown, Solberg and Hansen, Intelligentsia",Honduras,2005
2995,3,720.0,Las Amazonas,Ezri Moises Herrera Urizar Lote # 2,"Chinacla, La Paz",91.75,,,3,3.1,11317.65,Yamada Coffee for Mikatajuku Group,Honduras,2005
2996,4,600.0,Las Marias,Mario Leonel Noriega Paz,"Quimistan, Santa Barbara",90.73,,,4,5.15,15668.25,Time’s Club Inc.,Honduras,2005
2997,5,330.0,Mira Valle,Miroslav Cuculiza,"Guiamaca, Francisco Morazan",90.2,,,5,6.3,10541.84,"Breaking New Grounds, Terroir Select, Coffee Tree Roasters, and Mocha Joes",Honduras,2005
2998,6,810.0,Montepeque,Marco Antonio Landaverde Duarte,"Corquin, Copan",90.15,,,6,2.55,10473.39,"MOCCA kaffebar & brenneri, Norway and De Eenhoorn koffie en thee, The Netherlands",Honduras,2005
2999,7,510.0,Poso Negro,Wilmer Alexi Grau Montoya,"Masaguara, Intibuca",89.68,,,7,4.7,12154.3,Caravan Coffee for Kahisakan,Honduras,2005
3000,8,630.0,Yaquelin,Genaro Aguilar Nolasco,"San Juan, Intibuca",89.28,,,8,2.05,6548.72,"Arab Coffee , Asahi Coffee & Tashiro Coffee.",Honduras,2005
3001,9,480.0,La Cuesta,Obdulio Calix,"Catacamas, Olancho",89.08,,,9,3.05,7423.41,San Antonio Coffee Roasters,Honduras,2005
3002,10,900.0,Tivo,Natividad Quintanilla Dubon,"Atima, Santa Barbara",88.15,,,10,1.65,7529.89,Counter Culture Coffee,Honduras,2005
3003,11,540.0,Cerro Oscuro,Manuel De Jesus Villeda Portillo,"Lepaera, Lempira",88.68,,,11,5.05,13827.61,"Caravan Coffee Co.,Ltd.",Honduras,2005
3004,12,720.0,Los Cipreces,Marysabel Caballero Garcia Lote # 1,"Chinacla, La Paz",88.52,,,12,2.05,7484.25,"Wataru & Co., Ltd.",Honduras,2005
3005,13,600.0,El Cedro,Ricardo Corrales Sandoval,"San Marcos De Colon, Choluteca",87.73,,,13,3.55,10800.45,Caravan Coffee for Kyokuto Fadie,Honduras,2005
